en,ja,video_id,start,end
increase the heat and once the noodles are properly cooked add corn starch mixture bringing it to boil,火を強め、麺が茹で上がったら水で溶いたコーンスターチを加えて沸騰させます,Z6c8hIW7bhI,373,391
heat some oil in a pan and cook chopped onions in it,フライパンに油を熱し、刻んだ玉ねぎを炒めます,Gs7Bg6hLo84,42,54
cook a pot of mixed vegetables including lentils green onion and carrot with water,鍋に水を入れ、レンズ豆、青ねぎ、にんじんなどの野菜を茹でます,0-OWf7eul6w,83,95
cook the green beans in a pot of water,鍋に水を入れていんげんを茹でます,JlXYqpEWUuA,366,368
add 1 tsp of sesame oil stir everything evenly and cook for some time,ごま油小さじ1を加え、すべての材料を均等に混ぜ、しばらく炒めます,pPG5iylCGlA,307,318
cook them in an oven,オーブンで焼きます,vw9FgztLKFc,318,361
remove the cooked foie gras and pat it with a towel to strain excess oil,焼けたフォアグラを取り出し、タオルで余分な油を切ります,imfl-NXiU8g,319,324
garnish it with chopped pork cooked baby bok choy and then serve,刻んだ豚肉と炒めたチンゲン菜を添えて出来上がりです,X4T4XjWNUgc,312,328
add cooking oil in a pan and cook the tofu chunks in it,フライパンにサラダ油を入れ、さいの目に切った豆腐を炒めます,C_6yMh3tEQk,177,222
add in cabbage spring onion and bean sprouts and cook until everything is ready,キャベツ、青ねぎ、もやしを加えて、すべての材料に火が通るまで炒めます,gB6Fd4D697s,273,320
cook pasta in boiling salted water,塩を入れた沸騰した湯でパスタを茹でます,r-s3tFLCqxM,77,81
place the sandwich in the pan and cook until brown on both sides,サンドイッチをフライパンに入れ、両面がきつね色になるまで焼きます,G3k0rnWXK_c,41,53
boil cup of water add pinch of salt add half cup of quinoa cover pot let cook for 15 minutes,水1カップを沸かし、塩ひとつまみとキヌア1/2カップを加えて鍋に蓋をし、15分茹でます,Qodppi8e68k,35,74
add a little salt to the eggs and stir to cook the eggs in the sauce pan,卵に塩を少量加えて混ぜ、ソースパンで混ぜながら炒ります,s9r-CxnCXkg,63,90
add some chopped lettuce in the soup and cook them,刻んだレタスをつゆに加えて煮ます,aYyh8axyDg8,263,274
add cinnamon some cumin seeds and some cloves and cook the lamb,シナモン、クミンシード、クローブを加えてラムを炒めます,jpQBWsR3HHs,100,143
add three finely diced potato clams and rich creme and cook the potatoes,細かくさいの目に切ったじゃがいも3個、アサリ、生クリームを加え、じゃがいもに火を通します,UaQ_PwDnIis,262,298
stir a bit and cook until browned and crust forms,軽く混ぜ、きつね色になり表面がカリカリになってくるまで焼きます,pYhiIrlXY7I,149,196
cook the bacon on a large skillet until evenly brown,大きなスキレットでベーコンを均一に焼き色が付くまで焼きます,7PATXwoKFeI,57,71
add in the chicken mix and cook,鶏肉を加えて混ぜ、炒めます,K6Uk5vNi1_Q,327,350
cook the dosa on the skillet with oil,スキレットに油をかけドーサを焼きます,VA_7l_TXcMs,421,488
heat some oil in a pan and cook minced beef,フライパンに油を熱し、牛ひき肉を炒めます,62H65wNWMZo,16,28
cook the macaroni in boiling water,沸騰したお湯でマカロニを茹でます,QUV_oA9DrGw,62,92
add some vegetable oil in a pan add shrimp and cook for a minute,フライパンに植物油を入れ、エビを加えて、1分間炒めます,o4gTZoW0SXI,101,129
add oil and cook chicken in the pan,フライパンにグレープシードオイルを加えて鶏肉を焼きます,YgFwFoqglKc,110,135
cook until the bottom of the dosa starts to turn golden brown,ドーサの下の面がきつね色になるまで焼きます,5SMOBHTBPjA,271,292
add grapeseed oil cooked rice and vegetables to the wok and stir,中華鍋にグレープシードオイル、炊いたご飯、野菜を加えて混ぜます,YgFwFoqglKc,139,180
cook the mixture,混ぜたものを煮ます,3XKJ07sLiPE,80,84
rub butter on top of the cooked bread,焼きあがったパンの上にバターを塗ります,rLBQ2Wglw6Y,275,301
make space on one part of the pan and add grated cauliflower and fry and cook for 5 minutes mixing all together,フライパンの一部にスペースを開けて、すりおろしたカリフラワーを加え、すべてを混ぜながら5分間炒めます,dqksjDlrqq8,369,431
flip the foie gras and cook the other side,フォアグラを裏返し、反対側を焼きます,Ck3oNHsLqfk,118,142
remove the cooked foie gras in a plate,焼けたフォアグラを皿に取ります,JanpGgH1TaA,403,409
cook the pizza on the baking tray in the oven,天板のピザをオーブンで焼きます,ulTKMWIQR30,67,72
place the cooked foie gras on the salad along with fried potato wedge and serve,焼いたフォアグラをサラダにのせ、フライドポテトを添えて出来上がりです,yqpMSBZaNno,128,131
cook the pizza in the oven,ピザをオーブンで焼きます,zJoy52YuVXs,124,152
cook pasta put cooked pasta on a plate and top it with the sauce,パスタを茹でて皿に盛り、ソースをかけます,zWHu95io9B4,205,215
cook the onions in the pan with oil and salt,フライパンに玉ねぎを入れてオリーブオイルと塩を加えて炒めます,nJzDfRIb9T0,88,118
cook the snails in the oven,カタツムリをオーブンで焼きます,fJ47lmh3uiU,531,561
cook some garlic with vegetable oil,植物油でニンニクを炒めます,PqyqB_FkWrQ,221,230
mix the ingredients in the pan add tomato puree and lemon juice and cook the mixture until smooth,フライパンの材料を混ぜ、トマトピューレとレモン汁を加えて、なめらかになるまで炒めます,mtX4PAsQR70,267,395
cook the bratwursts on the grill,グリルでブラートヴルストを焼きます,Eci1mvWcQuI,71,92
cook the bacon in a heated pan and then remove it from the pan,熱した鍋でベーコンを炒め、取り出します,CIRA1IC9shc,64,81
cook the pizza in the oven,ピザをオーブンで焼きます,c96tGPyKB0c,104,136
cook on a medium flame for 8 to 10 minutes while stirring occasionally,ときどきかき混ぜながら、中火で8～10分煮ます,FeUEV0a6I5I,79,87
add cooking oil and beat an egg,サラダ油をひき、卵を入れてかき混ぜます,C_6yMh3tEQk,452,477
place chicago hot dogs on the grills and cook for few minutes,グリルにシカゴ風ホットドッグをのせ、数分間焼きます,qOB709GWcE8,61,83
turn off heat and add whisked mixture to cooked spaghetti and stir constantly adding pasta water to get creamy consistency,火を止め、茹で上がったスパゲッティに混ぜた材料を加え、パスタの茹で汁を加えながら滑らかになるまで絶えず混ぜます,QepadF9vOdA,250,289
cook the noodles,麺を茹でます,WO4EXX5DJHQ,223,226
place the seasoned foie gras in the pan and cook until it is golden brown and,味付けしたフォアグラをフライパンに入れ、きつね色になるまで焼きます,imfl-NXiU8g,287,318
add one cup of cooked chick peas and 1 cup of chopped broccoli,茹でたひよこ豆1カップと刻んだブロッコリー1カップを加えます,WEAobzGzPFI,99,103
cook the onion rings in the oven,オニオンリングをオーブンで焼きます,0IuQKThr-pM,133,140
spread some olive oil on some lettuce and cook on the grill,レタスにオリーブオイルを塗り、グリルで焼きます,qpxPlQ0IfLk,176,213
cook the noodles in a pot of water,水を入れた鍋で麺を茹でます,FQRC8urWpew,121,126
remove the pan off the coal heat and close the grill lid and let it cook indirectly for about half an hour,フライパンを炭火が直接当たらない場所に移動させ、グリルの蓋を閉めて、間接加熱で約30分間調理します,a3ZvOvo49WE,267,300
cook the finely chopped cabbage and onion in the same skillet,同じスキレットで、細かく刻んだキャベツと玉ねぎを炒めます,7PATXwoKFeI,96,121
mix all the ingredients well by adding little bit of sherry cooking wine until the mixture reaches proper consistency,混ぜた材料に適当なとろみがつくまで料理用シェリー酒を少量ずつ加えながら全体をよく混ぜ合わせます,QTSklobANsU,198,247
add baby corn carrots onions red bell pepper which are finely chopped and cook it with shrimp for 2 mins,細かく刻んだベビーコーン、にんじん、玉ねぎ、赤ピーマンを加え、エビと一緒に2分間炒めます,o4gTZoW0SXI,130,155
place it in the oven and cook it for 10 minutes and serve,オーブンに入れ、10分焼けば出来上がりです,W4nvDoCtdHM,161,179
cook the rolls in the oven,春巻をオーブンで焼きます,2Q-Nq6kxpfg,178,185
keep stirring until everything is cooked and evenly mixed,全体に火が通り、均一に混ざるまで混ぜます,8QCW0qWbNeI,261,274
add mustard seeds and chana dal and cook until seeds crack,マスタードシード、チャナダールを加えて種が弾けるまで熱します,cxijjHcz70Q,103,133
cook the falafel balls in the oil,ボール状のファラフェルを油で揚げます,TvnrmFuz0G8,302,319
add the cooked chicken breast and eggs to the fried rice and mix together,炒めておいた鶏むね肉と卵を炒飯に加え、混ぜ合わせます,DBJUD9V-1rQ,216,235
cook the finely chopped onions in it,玉ねぎのみじん切りを入れて炒めます,tlGFRoMj4uE,68,82
when the egg is cooked add shrimp and stir,卵に火が通ったら、エビを加えてかき混ぜます,_HYoidFnb5w,104,126
put some washed mussels in the pan and cover to cook,洗ったムール貝をフライパンに入れ、蓋をして煮ます,lYiKwaclCZQ,163,186
cook onion and lamb in a pan,玉ねぎとラムをフライパンで炒めます,rlHZ8xe9G10,45,73
add chopped garlic peanut oil and marinated shrimp and stir fry until cooked,刻んだニンニク、ピーナッツオイル、マリネしたエビを加え、火が通るまで炒めます,rXR5nuiXtZQ,85,104
cook in the oven at 375 degree for 12 minutes,375度のオーブンで12分焼きます,mrHTodOjHOc,316,343
cook the meat in the pot,鍋で肉を炒めます,NktYVXNREVY,250,290
cook the spaghetti,スパゲッティを茹でます,t1cUwX4Xzt0,62,64
add some tomato sauce and parmesan cheese on top of chicken breast and cook it in the oven,鶏むね肉の上にトマトソースとパルメザンチーズをかけ、オーブンで焼きます,bqmkNRNd5yw,415,501
cook the eggs in the microwave,卵を電子レンジで調理します,6hs8dZuzIFs,50,58
add 1 tsp salt stir and cook,塩小さじ1を加えて混ぜ、煮ます,v7U70gPylBA,159,161
add finely chopped onions and stir to cook,赤玉ねぎのみじん切りを加えて混ぜながら炒めます,uI-vgcqOioU,141,154
boil some water add chopped potatoes and cook,お湯を沸かして切ったじゃがいもを加えて煮ます,sT594H2u4kk,91,95
add some more water and cook until carrots and parsnips are half tender add potatoes and cook with lid covered,さらに水を加え、にんじんとパースニップに半分火が通るまで煮たら、 ジャガイモを加えて蓋をして煮ます,i4ZAwUoP8c4,176,199
add in the onions and the brat and cook in the pan,玉ねぎとソーセージをトレイに加えて煮ます,SHGY7kKeLq8,167,183
add the chopped parsley to the cooking ingredients in the pan and salt,フライパンで炒めている材料に刻んだパセリを加え、塩をふります,dqksjDlrqq8,324,363
flour the liver and cook in the pan,レバーに小麦粉をまぶし、フライパンで焼きます,djKnQP_LvSk,260,339
stir fry until the eggs are cooked,卵に火が通るまで炒めます,EpMbu7EIYf0,122,196
cook the naan until large bubbles form,大きな気泡ができるまでナンを焼きます,3cVVML1OLNM,31,95
cook the bacon pieces,ベーコンを炒めます,AGq4lnC_WVo,150,162
add coriander powder red chili powder and mix properly and cook stirring in between,コリアンダーパウダーと赤唐辛子粉を加えてよく混ぜながら煮ます,zKS6PpS5WKQ,271,315
add ginger garlic and onions and cook,ショウガ、ニンニク、玉ねぎを加えて炒めます,RXljYbddo7g,230,237
cook the pears in a pot with butter sugar mustard and pepper,バターを溶かした鍋で梨、砂糖、マスタード、コショウを炒めます,CElmXCveb48,158,180
pour the prepared sauce into the pan and cook until the sauce thickens,用意したソースをフライパンに注ぎ、ソースにとろみがつくまで混ぜます,AEpS4UBE6ds,202,224
add pepper cooked egg sesame oil red pepper paste and mix everything,コショウ、目玉焼き、ごま油、コチュジャンを加え、すべてを混ぜ合わせます,6KCWzRfFyr4,519,564
take the bacon out when it is cooked,ベーコンに火が通ったら取り出します,f-h7OM5HM0Q,167,183
slice a potato into cubes and cook in salted boiling water,じゃがいもをさいの目に切り、塩を入れたお湯で茹でます,r10vxqLvy7U,102,107
cook the pan of sausages in the oven,ソーセージを入れたフライパンをオーブンで焼きます,BL8oJSnL4EE,132,135
cook the potatos in boiling water,沸騰したお湯でじゃがいもを茹でます,w7jJ8nsbbKI,25,34
cook the pizza in the oven,ピザをオーブンで焼きます,KCIGy7lt_Og,252,257
cook the sushi rice,寿司用のご飯を炊きます,khmRPBMz6do,115,131
cook the bean sprouts in a pan,フライパンでもやしを炒めます,_XxXWiOoyhY,103,115
cook bacon and onions in a pan with butter,バターを入れたフライパンでベーコンと玉ねぎを炒めます,91z7e22XGy8,192,206
put minced garlic to the cooked pancetta and cook for 30 secs,炒めたパンチェッタにニンニクのみじん切りを加え、30秒炒めます,on8-O_f69ys,213,223
cook the pizza in an stove,ピザをコンロで焼きます,HP_quieYDVQ,258,307
cook the pasta in boiling water,沸騰したお湯でパスタを茹でます,__5RJw4UP1Y,94,104
add some chopped potatoes and chicken and cook for 10 minutes,刻んだじゃがいもと鶏肉を加えて10分煮ます,f9mlIEtVt5s,166,185
let it cook on low heat and then flip it,弱火で焼いてから裏返します,RoLhMa9SHsI,140,158
add 2 cups of water stir and cook,水2カップを加えて混ぜ、煮ます,v7U70gPylBA,256,276
cook some kangaroo bangas on a pan,フライパンでカンガバンガを焼きます,Ij-B7-rcK0Q,218,224
drizzle with hollandaise sauce,オランデーズソースをかけます,BTMd6rcevns,140,155
drizzle the bread with olive oil,パンにオリーブオイルを垂らします,U10oixMc9_k,137,144
place the pasta onto a plate and drizzle with olive oil and cheese,パスタを皿に盛り、オリーブオイルとチーズをかけます,T9YvpcxCC2I,220,270
drizzle some oil on top of the meat,肉の上に油を垂らします,tasuUgO6m3c,194,206
drizzle little margie sauce or soy sauce and serve,マギーソースまたは醤油を垂らして、出来上がりです,YuY7aqO0HxU,562,570
transfer to a bowl and drizzle with olive oil and pepper flakes,ボウルに移し、オリーブオイルを垂らし、ペッパーフレークを散らします,GEXox3R0-bk,187,230
drizzle some oil on top some bread and heat them in a pan,パンの上に油を垂らして、フライパンで熱します,i8BjqgemuXo,101,110
drizzle the dressing on the bagel,ドレッシングをベーグルにかけます,_hj6IRUNvUs,190,203
drizzle a little olive oil and add a little salt on it,オリーブオイルを少量垂らし、塩を少々ふります,oVPr2LAyhRM,77,84
drizzle some oil and sprinkle spring onions on top,ごま油をかけ、青ねぎを散らします,6MBctYaMU8U,391,409
garnish the baked pizza with parsley and drizzle with the balsamic vinegar sauce,焼いたピザをパセリで飾り、バルサミコ酢のソースを垂らします,dkvHu_2X9rs,199,211
heat olive oil in a pan and fry the chicken,フライパンにオリーブオイルを熱し、鶏肉を焼きます,Sh33vaPTI0Q,120,172
fry the chicken in a pot with oil,油を入れた鍋で鶏肉を揚げます,_pwC3oNzQT8,277,291
fry the canadian bacon,カナディアンベーコンを炒めます,jRdA68GbUMg,189,210
sprinkle green onions and fried shallots on top,青ねぎとフライドエシャロットを散らします,1MOHn-ARnD4,111,123
add garlic and mushrooms to the frying pan and saute,フライパンにニンニクとマッシュルームを加えて炒めます,1uCNsybhEAg,103,115
fry the dry fruits in oil and transfer to a bowl,ドライフルーツを油で揚げ、ボウルに移します,WCBuVWAvJYE,122,147
fry the marinated chicken in a frying pan,マリネした鶏肉をフライパンで揚げます,oHISYcjakpk,189,217
coat the dog with the batter in the cup and fry it in the oil,ソーセージをコップの衣に浸し、油で揚げます,M6gouTbPn70,140,150
fry the squid in oil in a pan,フライパンの油でイカを揚げます,8pYjtrt5Kbg,125,149
fry the beef in a pan with salt and pepper,フライパンに牛肉を入れ、塩とコショウをふって焼きます,G1ZdFe9x-U8,23,54
remove the lid from the frying pan,フライパンの蓋を取ります,cppB7IXFySk,163,164
boil them in boiled water and fry them with onion and butter and then serve,沸騰したお湯で茹で、玉ねぎとバターと炒めて出来上がりです,tlGFRoMj4uE,484,505
crack and fry two eggs,卵2個を割って焼きます,qmoqJRP5N6E,193,194
fry the meat in the pan,フライパンで肉を焼きます,G5dAW-jtLhg,107,117
fry the chicken pieces in oil for 5 minutes on each side under medium flame,鶏肉を油に入れ、片面5分ずつ中火で揚げます,vHpqMItXGzg,90,127
top the noodles with some fried mushrooms bean sprouts grated carrots chopped scallions and chopped red chilies,麺の上に、炒めたヒラタケ、もやし、にんじんの千切り、刻んだねぎ、刻んだ赤唐辛子をのせます,MxcI4wQLvK4,211,247
after the sauce is reduced and coated add textured vegetable protein and mix well and fry further,ソースが煮詰まり絡んだら、植物性組織化タンパク質を加えてよく混ぜ、さらに炒めます,zhacHWSMigs,242,252
fry the marinated calamari in oil,マリネしたカラマリを油で揚げます,OT-kq11Q8fU,181,212
add brown sugar to the bacon before frying,焼く前にベーコンにブラウンシュガーをふります,v-GtKLHLmsU,113,130
fry the chicken in a skillet with hot oil,スキレットで熱した油で、鶏肉を揚げます,hXkepSgN_zo,156,205
fry the beef and an egg,牛肉と卵1個を炒めます,qRUbmEZ6oiA,240,263
fry the chicken for 4-5 minutes on each side,鶏肉の両面を4～5分ずつ揚げます,fq37BTAjPHk,384,406
fry the ham peppers and onions in a pan,フライパンでハム、パプリカ、玉ねぎを炒めます,pOP5Zzm19kc,101,137
spread oil in a frying pan,フライパンに植物油をひきます,hJzPVZf6JVo,194,209
stir fry some red cabbage with the sesame oil,赤キャベツをごま油で炒めます,e2t_1Atddaw,144,153
heat oil in a pan and fry the pot stickers,フライパンに油をひき、餃子を焼きます,9gCDpktlxfs,114,140
fry the schnitzel,シュニッツェルを揚げます,HJBQ-NgQ9T0,319,376
fry the chorizo in the pan,チョリソーをフライパンで焼きます,olrxEUXmlVA,107,128
fry the wings in the cooking oil,手羽肉を油で揚げます,DKk5IVcIWW8,53,60
fry the beef on a pan,牛肉をフライパンで焼きます,65235CscqdQ,139,180
fry the squid in the oil,イカを油で揚げます,5yJz2Sc7T5k,139,171
add olive oil to a pan then add prosciutto and pancetta and fry them,フライパンにオリーブオイルをひき、プロシュートとパンチェッタを加えて炒めます,zjgsP3zh1HU,52,84
fry the beef in the pan,フライパンで牛肉を焼きます,WO4EXX5DJHQ,50,73
fry the noodles burger in another pan on either sides,別のフライパンでバーガー形のヌードルを両面焼きます,qmoqJRP5N6E,160,163
fry more of the beef in a pan,フライパンでさらに牛肉を炒めます,twL5BU4aFCo,182,186
fry the beef and add mushroom garlic and cabbage leaf,牛肉を炒め、シイタケ、ニンニク、キャベツを加えます,Ex2yu23wyHA,62,96
fry the the chicken,鶏肉を揚げます,JzU12Qf5FPg,292,348
add oil to the frying pan and fry the skewers,フライパンに油をひき、串を焼きます,U5Eyu9IyG-I,443,487
fry the vegetables and beef in a pan,フライパンで野菜と牛肉を炒めます,twL5BU4aFCo,94,172
fry the falafel in the oil at 375 degrees until golden brown,ファラフェルを375度のキャノーラ油できつね色になるまで揚げます,OUeLe5uMZ6E,501,633
cut garlic and put in frying pan,ニンニクを切り、フライパンに入れます,BrtC6jhKBp0,75,94
coat the fish fillet in the mixture and fry it in the oil,魚の切り身に衣をまぶし、油で揚げます,KbigOSh4b7I,196,252
add water and oil to a frying pan,フライパンに水と油を入れます,cppB7IXFySk,142,147
fry the samosas into a pot of hot oil,鍋に熱した油でサモサを揚げます,7v2kaXqLNCY,220,245
stir fry the garlic and add the bacon,ニンニクを炒め、ベーコンを加えます,1LxRUKMCsrM,106,125
stir fry the mixture for 3 minutes till the rice gets cooked completely,ご飯に完全に火が通るまで、材料を3分炒めます,u-2aI2iptmM,159,179
fry the pork with oil and the green onion red onion carrot mushroom and chinese broccoli,油で豚肉を炒め、青ねぎ、赤玉ねぎ、にんじん、しいたけ、カイランと炒めます,Ap3g0IRcjzU,372,411
heat a pan with butter and fry the pierogi and onions,フライパンにバターを熱し、ピエロギと玉ねぎを炒めます,tKWl-njXhP0,308,365
fry the chicken breast with a little oil,鶏むね肉を少量のオリーブオイルで焼きます,usexIHfWXK8,143,200
fry the coated squid rings in oil in a pan,衣をつけたイカの輪切りをフライパンに入れて油で揚げます,bUIHg-RNR28,268,280
place a piece of deep fried tofu in a bowl and pour hot water onto it,油揚げを1枚ボウルに入れ、熱湯を注ぎます,9X5xmrZMX30,90,106
fry the beef pieces in a pan and add salt and pepper,鍋で牛肉を焼き、塩とコショウを加えます,3S1tnRkJ5OI,97,160
coat the chicken pieces with flour and fry them in the oil,鶏肉に小麦粉をまぶして油で揚げます,XOwypmUT5cc,325,403
heat up oil in a frying pan and cook the chicken,フライパンで油を熱して、鶏肉を焼きます,p2GVwIauFks,168,184
stir fry the vegetables including sprouts carrots onion zucchini and mushroom,もやし、にんじん、玉ねぎ、ズッキーニ、きのこを炒めます,qRUbmEZ6oiA,156,181
fry the meat in the pan,フライパンで肉を揚げます,GLYC8yfRSzE,117,136
when the noodle buns are crispy on one side given them a flip and fry the other side,ヌードルバンズの片面がカリカリになったら、ひっくり返してもう片面を焼きます,qmoqJRP5N6E,186,189
heat oil in a pan and fry the mixture,フライパンに油を熱し、混ぜたものを焼きます,_AZ5jo3y7V4,215,274
put some bacon in a pan at medium heat and fry it up,フライパンにベーコンを入れ、中火で炒めます,zFKhct4g8as,35,47
fry the shallots in the wok,中華鍋でエシャロットを炒めます,5IL3Zl6rUu4,355,367
break some fried pita bread and add to the salad,焼いたピタパンを砕いてサラダに加えます,L_g38nzrJDA,315,349
fry the pancetta in pan with garlic and parsely,パンチェッタをフライパンでニンニクとパセリと一緒に炒めます,t1cUwX4Xzt0,71,92
add udon noodles and stir to fry,うどんを加えて炒めます,gB6Fd4D697s,219,234
fry the shallots with more butter,バターを追加してエシャロットを炒めます,-lMphXmWvbk,381,392
fry some paste in a pan with oil,フライパンに油をひいてペーストを炒めます,lYiKwaclCZQ,129,141
fry some sausages on a pan and roll some bread out,ソーセージをフライパンで炒め、パンを伸ばします,d-Hwbg0PrNk,57,74
fry the spring roll,春巻を油で揚げます,9RRHAydI_xk,258,279
season the meat patty with the mixture and fry it on a grill,混ぜたものでミートパティを味付けし、グリルで焼きます,8lqdPpg3w08,158,176
fry the samosa in oil in a pan until golden brown,フライパンに油を入れて、きつね色になるまでサモサを揚げます,x2O99s2EOXg,300,316
fry the hot dog in the oil,ホットドッグを油で揚げます,VmxFWJkYAqk,277,292
fry the onions in a pan with salt pepper and herbs,玉ねぎを塩、コショウ、ハーブと一緒にフライパンで炒めます,IPl_MdY9yNQ,276,291
fry the burgers,バーガーを焼きます,pq2PcaRnzc4,189,206
fry the onion rings and drain them with newspaper,オニオンリングを揚げ、新聞紙で油を切ります,U0jn_DI5ESg,108,119
fry the chicken in a fryer,鶏肉をフライヤーで揚げます,i2bQ88Ci5p4,99,107
heat a little corn oil and fry the mutton pieces,少量のコーン油を熱し、マトンを炒めます,ALpzvKkohfQ,19,84
add 2 cloves of minced garlic to frying meat and keep stirring,炒めた肉類にニンニク2片のみじん切りを加えて混ぜ続けます,zjgsP3zh1HU,85,96
fry the pork in the pan,豚肉をフライパンで炒めます,_EtwHSuT4LA,67,93
fry the peppers,パプリカを炒めます,Nbl97Bp3Kzw,130,159
